{
  "version": 2,
  "program": "claude",
  "event": "pre_tool_use",
  "session": "s-1",
  "firing": "story-1",
  "fired_at_ms": 1,
  "actor": "agent",
  "environment": "main",
  "subagent": "",
  "accepts_lines": true,
  "launch": "",
  "tool": {
    "name": "Agent",
    "category": "agent",
    "files": [],
    "diff": null
  },
  "prompt": null,
  "raw": {}
}
