{
  "version": 2,
  "program": "claude",
  "event": "pre_tool_use",
  "session": "s-1",
  "firing": "story-1",
  "fired_at_ms": 1,
  "actor": "agent",
  "environment": "main",
  "subagent": "",
  "accepts_lines": true,
  "launch": "",
  "tool": {
    "name": "Edit",
    "category": "edit",
    "files": [
      "src/cart.py"
    ],
    "diff": {
      "path": "src/cart.py",
      "existed": true,
      "lines_added": 3,
      "lines_removed": 1
    }
  },
  "prompt": null,
  "raw": {}
}
