{"version":2,"program":"claude","event":"pre_tool_use","session":"s1","firing":"1-4","fired_at_ms":4,"actor":"agent","environment":"development","subagent":"","accepts_lines":false,"launch":"","tool":{"name":"Grep","category":"search","files":[],"diff":null},"prompt":null,"raw":{"hook_event_name":"PreToolUse","tool_name":"Grep"}}
