{"version":2,"program":"claude","event":"pre_tool_use","session":"s1","firing":"1-1","fired_at_ms":1,"actor":"agent","environment":"development","subagent":"","accepts_lines":false,"launch":"","tool":{"name":"Edit","category":"edit","files":["src/app.py"],"diff":{"path":"src/app.py","existed":true,"lines_added":2,"lines_removed":1}},"prompt":null,"raw":{"hook_event_name":"PreToolUse","tool_name":"Edit"}}
