{"version":2,"program":"claude","event":"pre_tool_use","session":"s1","firing":"1-5","fired_at_ms":5,"actor":"agent","environment":"development","subagent":"","accepts_lines":false,"launch":"","tool":{"name":"Agent","kind":"agent","files":[],"diff":null},"prompt":null,"raw":{"hook_event_name":"PreToolUse","tool_name":"Agent"}}
