{"version":2,"program":"codex","event":"post_tool_use","session":"s1","firing":"1-2","fired_at_ms":2,"actor":"worker:12","environment":"development","subagent":"","accepts_lines":false,"launch":"","tool":{"name":"apply_patch","kind":"write","files":["notes.md"],"diff":{"path":"notes.md","existed":false,"lines_added":3,"lines_removed":0}},"prompt":null,"raw":{"hook_event_name":"PostToolUse"}}
