{
  "version": 2,
  "program": "claude",
  "event": "pre_tool_use",
  "session": "s-1",
  "firing": "story-1",
  "fired_at_ms": 1,
  "actor": "agent",
  "environment": "main",
  "subagent": "",
  "accepts_lines": true,
  "launch": "",
  "tool": {
    "name": "Bash",
    "category": "shell",
    "files": [],
    "shell": {
      "line": "git status && journal task show 1",
      "parts": [
        {
          "text": "git status",
          "program": "git",
          "arguments": [
            "status"
          ],
          "classification": {
            "category": "version control",
            "effects": [
              "reads_files"
            ]
          },
          "subcommand": "status",
          "joined_by": "&&"
        },
        {
          "text": "journal task show 1",
          "program": "journal",
          "arguments": [
            "task",
            "show",
            "1"
          ],
          "classification": {
            "category": "journal",
            "effects": [
              "reads_files"
            ]
          }
        }
      ],
      "redirects": [],
      "category": "version control",
      "is_journal_only": false,
      "parse_error": ""
    },
    "diff": null
  },
  "prompt": null,
  "raw": {}
}
